{
  "authority": {
    "capture_evidence_only": true,
    "collision_authority": false,
    "metric_authority": false,
    "quality_claim": false,
    "trainer_consumption_claim": false,
    "training_execution_authority": false
  },
  "capture_profile": "video_3dgs_max",
  "evidence": {
    "capture_manifest": {
      "asset": "capture_manifest",
      "available": true
    },
    "confidence": {
      "available_frame_count": 1,
      "referenced_frame_count": 1
    },
    "depth": {
      "available_frame_count": 1,
      "referenced_frame_count": 2
    },
    "masks": {
      "available_frame_count": 2,
      "referenced_frame_count": 2
    },
    "mesh": {
      "asset": "navigation_mesh",
      "available": true,
      "report_asset": "mesh_report",
      "report_available": true
    },
    "sfm": {
      "asset": "colmap_sparse",
      "available": true,
      "camera_count": 2,
      "camera_models": ["OPENCV", "PINHOLE"],
      "registered_images_available": true,
      "sparse_points_available": true
    }
  },
  "projection": {
    "mode": "projected_pinhole_from_equirectangular",
    "native_equirectangular": false,
    "rig_evidence": {
      "available": true,
      "checksum": "sha256:bbbbbbbbbbbbbbbbbbbbbbbbbbbbbbbbbbbbbbbbbbbbbbbbbbbbbbbbbbbbbbbb",
      "schema": "capture_splat.equirectangular_rig.v0.1"
    },
    "source_is_equirectangular": true,
    "training_images_are_projected_pinhole": true
  },
  "schema": "capture_splat.training_dataset.v0.1",
  "source_frame_set": {
    "canonicalization": "utf8_relative_path_nul_size_nul_sha256_lf_v1",
    "count": 2,
    "digest": "sha256:cccccccccccccccccccccccccccccccccccccccccccccccccccccccccccccccc"
  }
}
